[
  {
    "schema": "jarvis.web.request.v1",
    "protocol_version": "1.0",
    "contract_fingerprint": "445e4013df96ad986232eaecec6c58c01bab472e2a55c5ec11c54536de552021",
    "request_id": "cancel-command-001",
    "trace_id": "trace-cancel-001",
    "user_id": "owner-001",
    "device_id": "device-001",
    "session_id": "session-cancel-001",
    "conversation_id": "conversation-cancel-001",
    "task_id": "task-cancel-001",
    "run_id": "run-cancel-001",
    "operation": "cancel",
    "target_request_id": "req-cancel-target-001",
    "payload": {}
  },
  {
    "schema": "jarvis.web.request.v1",
    "protocol_version": "1.0",
    "contract_fingerprint": "445e4013df96ad986232eaecec6c58c01bab472e2a55c5ec11c54536de552021",
    "request_id": "cancel-command-002",
    "trace_id": "trace-cancel-002",
    "user_id": "owner-001",
    "device_id": "device-001",
    "session_id": "session-cancel-001",
    "conversation_id": "conversation-cancel-001",
    "task_id": "task-cancel-001",
    "run_id": "run-cancel-001",
    "operation": "cancel",
    "target_request_id": "req-cancel-target-001",
    "payload": {}
  }
]
